name,img,rating,review_count,price,short_desc,long_desc,url,latitude,longitude,address,open_hours
HCMC History Museum,https://ak-d.tripcdn.com/images/100w1f000001gwb0uD280.jpg,4.5,139,0,"Informative museum, it has a logical layout - going through historical eras, with a wide array of different exhibits. You can spend an hour to two hours here reading and looking at the exhibits.","The History Museum was built by the French in 1929. There are various cultural relics in the cultural evolution process of Vietnam in various periods since 3,300 years in the museum. There are many stone tools, ancient bronzes, stone tablets, bronze drums, Champa art, pottery and ethnic costumes, etc., all of which are very precious. It is a place where you can learn about the history of Vietnam. The museum is mainly divided into two stages, the first stage is ancient Vietnam, and the second part is Vietnam after the establishment of the Communist Party of Vietnam. The display of the first stage is divided into several halls, basically each dynasty in the ancient history of Vietnam is an exhibition hall. The exhibition halls in the second part display many important historical relics of South Vietnam and North Vietnam according to various themes, including ancient pottery. Many of these exhibits are powerful evidences that reflect the ancient culture of Vietnam. In addition, the museum also preserves a large number of important historical relics, and these exhibits are displayed separately from other exhibits. In the three-cuddle library at the rear of the museum, there are also collections of books from the French colonial period, and the research materials are quite rich. In Den Hung, directly opposite the museum, the founding monarch (Hung King) of Vietnam and his ancestors are also enshrined.",https://www.trip.com/travel-guide/attraction/ho-chi-minh-city/hcmc-history-museum-84528?curr=USD&locale=en-US&scene=gsDestination,10.788075,106.704729,"2 Nguyễn Bỉnh Khiêm, Bến Nghé, Quận 1, Hồ Chí Minh, Vietnam",1:00 PM-5:00 PM;8:00 AM-11:30 AM
Saigon River,https://ak-d.tripcdn.com/images/100u0y000000lzuvjA097.jpg,4.3,207,0,"This tour was exceptionally good value for money. The food was good, and it was all labelled in both Vietnamese & English. I believe this trip is a must do trip whilst in Ho Chi Minh City. I would recommend to all, incredibly good bang for your buck.","Saigon River originates from Cambodia and runs from the east to the west throughout Ho Chi Minh City,connecting the Mekong Delta. It is the main waterway of Saigon Port. It is nice to take a cruise on the Saigon River. Most cruises offer dinner and performances. Saigon River is quiet during the day. However at night, the lights on the shore shine over the river and it becomes romantic dating site for many young couples.",https://www.trip.com/travel-guide/attraction/dau-tieng-district/saigon-river-10547161?curr=USD&locale=en-US&scene=gsDestination,11.142284,106.507932,"Saigon River, Ho Chi Minh City, Vietnam",
Bui Vien,https://ak-d.tripcdn.com/images/0102i12000lreskfbFCE8.jpg,4.5,33,0,the loud music in the street lightens up the mood! food & drinks price are reasonable,"Pei Yuan Street is like a ""United Nations"", all-encompassing and everything. The bustling streets are often filled with the taste of fish sauce, curry, cheese and soy sauce. It seems that it has never ""slept in"", no matter how dim the corner is, the lights are always on, and Peiyuan Street after midnight is even more lively. After renovation, Pei Yuan Street officially became a pedestrian street on the evening of August 20, 2017, becoming the second pedestrian street in Ho Chi Minh City. In addition to providing entertainment and public places for domestic and foreign tourists, there are also two cultural performance stages on Peiyuan Pedestrian Street, providing venues for various festivals, street performances, modern and ethnic music performances.",https://www.trip.com/travel-guide/attraction/ho-chi-minh-city/bui-vien-35810140?curr=USD&locale=en-US&scene=gsDestination,10.766892,106.692826,"Pham Ngu Lao, District 1, Ho Chi Minh City, Vietnam",Open all day
Master Escape,https://ak-d.tripcdn.com/images/0HJ3612000ih9y6my9C74.jpg,0.0,0,0,,"Master Escape is a gaming venue specializing in escape room experiences. Teams of four to ten players enter uniquely themed rooms, typically lasting 60 minutes. Each room features a carefully designed plot, with puzzles ranging from number-based, direction-based, and word-based, encompassing elements of mathematics, chemistry, and history. Players must observe, analyze, and solve clues to escape. Throughout the experience, staff members provide support as ""story guides,"" offering prompts when players get stuck and providing voice narration to help the story progress and ensure a smooth flow. Master Escape's meticulously designed environments, along with authentic interactions with NPC characters, significantly enhance the game's atmosphere. Due to its convenient urban location and its highly praised décor and user experience, it has become a popular choice for group activities, friend gatherings, and corporate team-building events in Ho Chi Minh City.",https://www.trip.com/travel-guide/attraction/ho-chi-minh-city/master-escape-147375686?curr=USD&locale=en-US&scene=gsDestination,10.758035,106.67462,,9:00 AM-12:00 AM
Tao Dan Park,https://ak-d.tripcdn.com/images/0ww41120009evarvzCFC4.jpg,4.7,3,0,i wish my country has a city park as big and as calm as this park. i could just sit here and enjoy everything.,"This is a beautiful city park. It not only has gardens, lakes, fountains, sculptures and other attractions, but also facilities such as children's playgrounds and sports fields. It is a great place for people to relax and exercise.",https://www.trip.com/travel-guide/attraction/ho-chi-minh-city/tao-dan-park-133828415?curr=USD&locale=en-US&scene=gsDestination,10.774538,106.692442,,7:00 AM-10:00 PM
Saigon Exhibition and Convention Center (SECC),https://ak-d.tripcdn.com/images/100f1f000001gqbiu72AC.jpg,4.1,16,0,"There are many things I don't know because it's Vietnamese, but there are performances and exhibitions. It's like COEX in Korea. I got my vaccine here, and I went to a baby product exhibition and an interior design exhibition, and the interior design was sold between companies.","This is an exhibition center capable of hosting various large-scale events, including exhibitions and conferences. It includes a 40,000-square-meter exhibition hall with four entrances and exits, an outdoor plaza ranging from 15,000 to 20,000 square meters, a conference center with a seating capacity of 2,000, an office building, two 400-room four-star hotels, and a 600-room five-star hotel. Furthermore, a large parking lot can accommodate all activities throughout the center.",https://www.trip.com/travel-guide/attraction/ho-chi-minh-city/saigon-exhibition-and-convention-center-30464864?curr=USD&locale=en-US&scene=gsDestination,10.730657,106.721344,"799 Đường Nguyễn Văn Linh, Tân Phú, Quận 7, Hồ Chí Minh, Vietnam",8:00 AM-5:00 PM
Back beach,https://ak-d.tripcdn.com/images/1A0q15000000y4s5jAD63.jpg,4.3,17,0,"I have been to Vung Tau many times, and I came and went in a hurry. This time I played seriously and found that Vung Tau's scenery is charming. Every time I come, I have new discoveries and different ways to play. I overlook the whole Vung Tau. [Scenery] Pleasant, continue [Fun]","Back Beach is also called Whale Beach. There is a huge whale sculpture on the beach, which is very distinctive. There is also a whale-themed seaside promenade, which is also very eye-catching.",https://www.trip.com/travel-guide/attraction/vung-tau/back-beach-58330792?curr=USD&locale=en-US&scene=gsDestination,10.345396,107.100013,"Vũng Tàu, Ba Ria - Vung Tau, Vietnam",Open all day
Thuy Chau Ecotourism,https://ak-d.tripcdn.com/images/0105p12000oh7q6pgC7C9.png,0.0,0,0,,"Located in Ho Chi Minh City, Vietnam, the Thuy Chau Ecotourism Area is a tourist destination that combines natural beauty with ecological conservation. The area is beloved by visitors for its vast wetland landscape, rich biodiversity, and traditional Vietnamese rural lifestyle. The Thuy Chau Ecotourism Area's main feature is its pristine water village landscape, featuring vast expanses of water, lush vegetation, and winding waterways. Visitors can enjoy the tranquil natural environment by rowing or riding traditional canoes along the rivers. The wetlands and waters are home to a variety of birds, fish, and other aquatic life, making the area an ideal place for observing and photographing natural life. The ecotourism area also preserves traditional local agricultural culture. Visitors can visit local farms and fishing villages to immerse themselves in the Vietnamese rural lifestyle. Visitors can also enjoy authentic Vietnamese cuisine, with many restaurants serving fresh seafood and locally grown ingredients.",https://www.trip.com/travel-guide/attraction/thi-xa-di-an/thuy-chau-ecotourism-144680432?curr=USD&locale=en-US&scene=gsDestination,10.901761,106.819698,,7:30 AM-6:00 PM
Mariamman Hindu temple,https://ak-d.tripcdn.com/images/0100312000f6sjurg7367.jpg,4.4,52,0,Reasons to Recommend: Ho Chi Minh hidden gem 💎 so exciting to find it herewas come for pray 🙏,"Mariamman Hindu Temple is located in Ho Chi Minh City, Vietnam. You can see it from Pham Ngu Lao and walking towards the big market. Built at the end of the 19th century, the temple is dedicated to the Hindu goddess Mariamman, and you need to take off your shoes to enter the temple. The whole temple is full of Indian colors, and the statues in the temple also reflect the characteristics of Hinduism, which is very exotic and is a holy place in the hearts of Vietnamese and local Chinese.",https://www.trip.com/travel-guide/attraction/ho-chi-minh-city/mariamman-hindu-temple-20905643?curr=USD&locale=en-US&scene=gsDestination,10.772398,106.695646,"45 Trương Định, Phường Bến Thành, Quận 1, Hồ Chí Minh 70000, Vietnam",Please contact the attraction to confirm specific opening hours
Vietnamese Cuisine Cooking Experiences in Ho Chi Minh City,https://ak-d.tripcdn.com/images/0105y12000hdlh2w584ED.jpg,0,0,0,,"Ho Chi Minh City invites you to take a cutting-edge cooking class, unlock the secrets of southern Vietnamese cuisine amidst the hustle and bustle, and embark on a journey that will amaze your taste buds. Diverse course content: Usually the course duration is 3-5 hours. Follow the chef teacher to the market to select ingredients, learn about local ingredients, and complete the purchase of ingredients needed for the course. The main cooking content is beef pho, Vietnamese spring rolls, egg pancakes and other specialties, and there are also different sets of dishes for you to choose from. Students can basically make 4-6 signature dishes of Ho Chi Minh City in one class. After completing the course, they can take away exquisite recipes, creative recipe cards and spices to record their unique experience and easily restore the delicious taste when they return home. Small class teaching, excellent teachers: Usually the teaching classes are strictly limited to small classes, with an average of no more than 10 people per class. Small classes ensure that the chefs give meticulous guidance, and students can have in-depth exchanges, stimulate creative inspiration, and explore the boundaries of food together. Most of the chefs teaching are locals, rooted in local cuisine. When teaching, we first share cutting-edge ideas, then provide practical guidance, and accurately control every link, so that students can improve their cooking skills rapidly. Fashionable facilities: The cooking area is spacious and bright, equipped with smart kitchen utensils and professional baking equipment. Drinks and desserts are usually provided, and the finished dishes can also be packed away. The ingredients are sourced from local suppliers and specialty farms, fresh, organic and abundant, adding color to the dishes and ensuring that students can prepare delicious Vietnamese cuisine. Experience a cooking class in Ho Chi Minh CityIt not only provides a profound food experience, but also brings students into a new culinary world through professional teaching. It is not only about making delicious food, but also the best way to experience Vietnamese culture. It helps you become a food trendsetter and leave a unique food memory.",https://us.trip.com/hotspoi/vietnamese-cuisine-cooking-experiences-in-ho-chi-minh-city-149905116/,10.770361,106.691508,,
Mekong Delta Cruise,https://ak-d.tripcdn.com/images/0105l12000f6pvsz98EA5.jpg,4.3,7,0,"The Mekong River seems to originate in Cambodia and passes through Ho Chi Minh City. The Saigon River is also the mother river of Ho Chi Minh City, connecting with the Mekong Delta. The Saigon River is also very busy, and the Saigon Port has trade relations with many ports in the world. Taking a cruise on the Saigon River is a must-do activity for every tourist traveling to Vietnam. It is such a wonderful thing to enjoy the beautiful scenery on both sides of the Saigon River while tasting Vietnamese cuisine on the Saigon River cruise.","The alluvial soil of the Mekong Delta is quite fertile. The fish and various agricultural products in this area are very rich. The market is full of rice, sesame, peanut, cashew, pineapple, dragon fruit and durian. You'll have countless opportunities to capture stunning landscapes, as well as the locals, as you pass by buffalo plowing orchards and rice fields. You will also have the opportunity to visit a local family and be invited to enjoy local fresh fruits or drinks. The chef will prepare a lunch of many Vietnamese dishes, such as the fried elephant fish unique to the Mekong Delta, as well as the usual food for poor children in local pagodas or schools. Vietnamese Spring Rolls .",https://www.trip.com/travel-guide/attraction/ho-chi-minh-city/mekong-delta-cruise-33524248?curr=USD&locale=en-US&scene=gsDestination,10.771721,106.706833,"Bach Dang, Ho Chi Minh",The specific business hours are subject to the opening conditions of the day
Kim Bien Market,https://ak-d.tripcdn.com/images/0HJ4x12000gxip4wnECE1.jpg,0.0,0,0,,,https://www.trip.com/travel-guide/attraction/ho-chi-minh-city/kim-bien-market-142785027?curr=USD&locale=en-US&scene=gsDestination,10.749989,106.655931,"37 Đ. Vạn Tượng, Phường 13, Quận 5, Thành phố Hồ Chí Minh 749000, Vietnam",6:00 AM-5:00 PM
Ho Chi Minh Square,https://ak-d.tripcdn.com/images/100h1f000001grsfs64AF.jpg,4.7,85,0,"A landmark check-in spot, between the City Hall and the Grand Theater, stands a statue of Uncle Ho Chi Minh in the square, with his head held high. The square is much smaller than expected, so just take a look when you pass by. There are many shopping places on both sides.","The statue of Ho Chi Minh stands in the center of the square, with the old French buildings behind it, and the new modern buildings around are also brilliantly lit. There are many crowds and street performers in the square, and there are many cafes and small businesses on both sides. This is a good place to experience the night view of the city.",https://www.trip.com/travel-guide/attraction/ho-chi-minh-city/ho-chi-minh-square-30633416?curr=USD&locale=en-US&scene=gsDestination,10.77601,106.701597,"Trường Thi, Vinh, Nghe An, Vietnam",
Ben Dinh War Tunnels,https://ak-d.tripcdn.com/images/0HJ5t12000h0fv2byD0C8.jpg,4.0,2,0,"The tunnels are great and the exhibits are amazing. The museum has rifles, shells, and even an M41 tank! The traps are really scary looking. The only downside is that the shooting is expensive, $28 for 10 rounds! It was hot when we visited the tunnels so we had to stop halfway. The guide told us that the Vietnam War was only between Vietnam and the United States. But people tend to forget that the Vietnam War was actually a war between North and South Vietnam.","The structure of the tunnel is very unique, and the exhibition hall also displays military items such as rifles and bullet casings, where you can experience shooting. It's a good field base.",https://www.trip.com/travel-guide/attraction/ho-chi-minh-city/ben-dinh-war-tunnels-136815841?curr=USD&locale=en-US&scene=gsDestination,11.062059,106.529197,"Đ. Tỉnh Lộ 15, Nhuận Đức, Củ Chi, Hồ Chí Minh, Vietnam",7:00 AM-5:00 PM
September 23rd Park,https://ak-d.tripcdn.com/images/0104t12000f6q8s876B0B.jpg,0.0,0,0,,,https://www.trip.com/travel-guide/attraction/ho-chi-minh-city/september-23rd-park-129757358?curr=USD&locale=en-US&scene=gsDestination,10.768711,106.69234,,
Quynh Nhu 137 Foot Massage,https://ak-d.tripcdn.com/images/0HJ5312000hcm00av00BC.jpg,0.0,0,0,,,https://www.trip.com/travel-guide/attraction/ho-chi-minh-city/quynh-nhu-137-foot-massage-56011300?curr=USD&locale=en-US&scene=gsDestination,10.770812,106.699906,"147-149, Hàm Nghi, Phường Nguyễn Thái Bình, Quận 1, Hồ Chí Minh 700000, Vietnam",10:00 AM-11:00 PM
THIÊN ÂN 369 foot&body massage,https://ak-d.tripcdn.com/images/0HJ3q12000ia0g43s9465.jpg,0.0,0,0,,,https://www.trip.com/travel-guide/attraction/vung-tau/thin-n-369-footandbody-massage-147591010?curr=USD&locale=en-US&scene=gsDestination,10.360185,107.09103,,Please contact the attraction to confirm specific opening hours
Front Beach Park,https://ak-d.tripcdn.com/images/0HJ0q12000h0e3i84F1EE.jpg,0.0,0,0,,,https://www.trip.com/travel-guide/attraction/vung-tau/front-beach-park-144080489?curr=USD&locale=en-US&scene=gsDestination,10.342078,107.074429,,Open all day
Công viên Vinhomes Central Park,https://ak-d.tripcdn.com/images/fd/tg/g1/M06/FC/24/CghzflW7H_iATdynAAA-FlXAIeA738.jpg,0.0,0,0,,,https://www.trip.com/travel-guide/attraction/ho-chi-minh-city/cng-vin-vinhomes-central-park-149784093?curr=USD&locale=en-US&scene=gsDestination,10.793431,106.724398,,Please contact the attraction to confirm specific opening hours
Water Puppetry in Vietnam,https://ak-d.tripcdn.com/images/1lo6g12000cn5cllw2E9C.jpg,0,0,0,,"Vietnamese glove puppetry is a unique traditional puppetry performance form that originated in the Red River Delta region in northern Vietnam. Unlike other glove puppetry, Vietnamese glove puppetry is generally performed on water, so it is also called ""water puppetry"". The performance venue is usually a shallow pool. The puppeteers stand behind the pool and manipulate the puppets with long poles and ropes to vividly perform various storylines on the water. The puppets are flexible and diverse in their movements, and can simulate various human movements such as dancing, fighting and fishing. The stories of Vietnamese glove puppetry are rich and colorful, and are usually based on Vietnamese folk tales, historical stories and rural life. Through humorous performances, the audience can not only enjoy the charm of art, but also understand the culture and traditions of Vietnam. During the performance, the accompaniment of traditional musical instruments and singing on the scene added more vividness and appeal to the puppet show. Vietnamese glove puppetry is not only popular in China, but also attracts a large number of international tourists to watch. In general, Vietnamese glove puppetry is a unique and charming performing art form that showcases Vietnam's rich cultural heritage and folk wisdom through the vivid interpretation of water puppets.",https://us.trip.com/hotspoi/water-puppetry-in-vietnam-149275309/,10.77626,106.692537,,
Ben Bach Dang Park,https://ak-d.tripcdn.com/images/0HJ3z12000ik7oej3DDA3.jpg,0.0,0,0,,,https://www.trip.com/travel-guide/attraction/ho-chi-minh-city/ben-bach-dang-park-142388978?curr=USD&locale=en-US&scene=gsDestination,10.774972,106.706427,"Đ. Tôn Đức Thắng, Bến Nghé, Quận 1, Hồ Chí Minh, Vietnam",Open all day
Go Vap Floral Village Park,https://ak-d.tripcdn.com/images/0HJ3q12000i4k5wwm6D45.jpg,0.0,0,0,,,https://www.trip.com/travel-guide/attraction/ho-chi-minh-city/go-vap-floral-village-park-143762248?curr=USD&locale=en-US&scene=gsDestination,10.841896,106.656146,,4:15 AM-9:45 PM
White Rabbit Amusement Park,https://ak-d.tripcdn.com/images/0HJ1z12000ikb1y997B9D.jpg,0.0,0,0,,,https://www.trip.com/travel-guide/attraction/ho-chi-minh-city/white-rabbit-amusement-park-143766394?curr=USD&locale=en-US&scene=gsDestination,10.785502,106.666053,,8:00 AM-10:00 PM
VinWonders Grand Park,https://ak-d.tripcdn.com/images/1lo5512000mi1vkus1A93.png,4.5,2,3.81,"Overall, the park has received feedback since it first opened and I feel quite satisfied. The water park has 6-7 thrilling rides during the week so it's not crowded, the area for children is also diverse and interesting. However, the park is dry because many rides are under maintenance so I can't play them.","VinWonders Grand Park is the new entertainment & festival center of Ho Chi Minh City. Revealing the highlight products with images: Dream Garden Amusement Park; Water Park with multi-level game complex; A series of exciting activities, mini-shows from day to night with a spectacular fireworks display for residents and visitors.",https://www.trip.com/travel-guide/attraction/ho-chi-minh-city/vinwonders-grand-park-148944283?curr=USD&locale=en-US&scene=gsDestination,10.83963,106.845691,,10:00 AM-6:00 PM
Ho May Amusement Park,https://ak-d.tripcdn.com/images/0HJ2v12000h037new32AD.jpg,4.3,10,7.21,"Vung Tau in Vietnam is a famous seaside place for eating seafood and playing in the water. It is about a 2.5-hour drive from Ho Chi Minh City. The price of seafood is not as cheap as you might think, and there don’t seem to be many varieties, but it’s okay to just walk around.","HoMayCulture&Ecotourismpark covers an area of 50 hectares, with fresh air and cool year-round, with an average temperature of 22-25°C, regulated by 400 hectares of natural forest. With these unique features, it's like a glittering gem on a hilltop.",https://www.trip.com/travel-guide/attraction/vung-tau/ho-may-amusement-park-50640614?curr=USD&locale=en-US&scene=gsDestination,10.351172,107.066464,"1a Trần Phú, Phường 1, Vũng Tàu, Bà Rịa - Vũng Tàu 790000, Vietnam",
Rạp CGV,https://ak-d.tripcdn.com/images/0HJ5q12000ioh80snBBAD.jpg,0.0,0,0,,,https://www.trip.com/travel-guide/attraction/ho-chi-minh-city/rp-cgv-142888575?curr=USD&locale=en-US&scene=gsDestination,10.80141,106.6175,,
Pullman Saigon Centre,https://ak-d.tripcdn.com/images/0ww3o12000cngpg4u8069.jpg,5.0,1,0,"It's in the city so it's easy to get around by car, but the pool is small so it's not great for kids.",,https://www.trip.com/travel-guide/attraction/ho-chi-minh-city/pullman-saigon-centre-55861396?curr=USD&locale=en-US&scene=gsDestination,10.764335,106.691666,"148 Trần Hưng Đạo, Boulevard, Quận 1, Hồ Chí Minh 070000, Vietnam",Please contact the attraction to confirm specific opening hours
Museum of Ho Chi Minh City,https://ak-d.tripcdn.com/images/100j1f000001gps1eC1CA.jpg,4.6,154,0,"A city museum located in a two-story French-style building. In terms of the exhibition hall and exhibits, the venue facilities are old and poorly maintained, and the exhibits have no highlights (the opera culture part is a supplement to other museums), and overall it barely passes.","The Ho Chi Minh City Museum was rebuilt from the Gia Long Palace built by the French. It was once an important political center of the Vietnamese regime. Now it is open to the public as a museum showing the history of the Vietnamese people's heroes resisting foreign aggression. The museum is a beautiful neoclassical off-white building, built in 1885. The museum displays artifacts from different periods of the Communist Party of Vietnam. It can be seen from some of the French Communist newspapers on display that Ho Chi Minh used the pseudonym NguyenAiQuoc to write for these newspapers during his stay in Paris. Also on display are the aircraft and other weapons used in that year, as well as some photos and documents. Compared with other museums in Ho Chi Minh City, this museum is somewhat inconspicuous, but it is also one of the rare tourist attractions.",https://www.trip.com/travel-guide/attraction/ho-chi-minh-city/museum-of-ho-chi-minh-city-98654?curr=USD&locale=en-US&scene=gsDestination,10.775966,106.699648,"65 Lý Tự Trọng, Bến Nghé, Quận 1, Hồ Chí Minh, Vietnam",
Dam Sen Cultural Park,https://ak-d.tripcdn.com/images/0HJ3812000hcsgz176230.jpg,0.0,0,0,,,https://www.trip.com/travel-guide/attraction/ho-chi-minh-city/dam-sen-cultural-park-141698250?curr=USD&locale=en-US&scene=gsDestination,10.766098,106.641894,,8:00 AM-5:00 PM
Chau Thoi Buddhist Temple,https://ak-d.tripcdn.com/images/0HJ5212000gn8xl5q0CCC.jpg,0.0,0,0,,,https://www.trip.com/travel-guide/attraction/xa-binh-thang/chau-thoi-buddhist-temple-146773815?curr=USD&locale=en-US&scene=gsDestination,10.915055,106.80449,,Please contact the attraction to confirm specific opening hours
