name,img,rating,review_count,price,short_desc,long_desc,url,latitude,longitude,address,open_hours
Chua Vinh Nghiem,https://ak-d.tripcdn.com/images/100f1f000001gqbsxFC22.jpg,4.6,17,0,"Yongyan Temple is still very famous in Ho Chi Minh City. Basically, all taxi drivers know it, and navigation and positioning is very easy. It seems that the temple has been renovated. It is magnificent and magnificent. The pagoda beside it is also very powerful. There are also stalls selling snacks in front of the temple.","Vinh Nguyen Temple is a large temple in Ho Chi Minh City. The road passing through the gate used to be the place where Nguyen Van Chase hero fought against the enemy. When visiting Yongyan Temple on the occasion of the Obon Festival, people can express their devotion to their parents and ancestors, and at the same time, they can participate in activities such as releasing animals and praying for peace.",https://www.trip.com/travel-guide/attraction/ho-chi-minh-city/chua-vinh-nghiem-22950915?curr=USD&locale=en-US&scene=gsDestination,10.790221,106.682149,"339 Nam Ky Khoi Nghia, District 3, Ho Chi Minh City 70000, Vietnam",Open all day
Real Escape Rooms-Service foreigners,https://ak-d.tripcdn.com/images/0HJ5m12000i92njm0414D.jpg,0.0,0,0,,,https://www.trip.com/travel-guide/attraction/ho-chi-minh-city/real-escape-rooms-service-foreigners-147408340?curr=USD&locale=en-US&scene=gsDestination,10.770324,106.670806,,Please contact the attraction to confirm specific opening hours
Phu Lam Park,https://ak-d.tripcdn.com/images/0HJ5k12000io8bxps19C3.jpg,0.0,0,0,,,https://www.trip.com/travel-guide/attraction/ho-chi-minh-city/phu-lam-park-142505412?curr=USD&locale=en-US&scene=gsDestination,10.747604,106.624783,"170 Đ. Kinh Dương Vương, Phường 13, Quận 6, Hồ Chí Minh, Vietnam",3:00 AM-11:00 PM
CGV Giga Mall Thủ Đức,https://ak-d.tripcdn.com/images/0HJ6i12000ioq2r6e7E6E.jpg,0.0,0,0,,,https://www.trip.com/travel-guide/attraction/ho-chi-minh-city/cgv-giga-mall-th-c-142515082?curr=USD&locale=en-US&scene=gsDestination,10.8276,106.721213,"Tầng 6 TTTM Giga Mall, 240, 242 Đ. Phạm Văn Đồng, Hiệp Bình Chánh, Thủ Đức, Hồ Chí Minh 700000, Vietnam",Please contact the attraction to confirm specific opening hours
Saigon Skydeck,https://ak-d.tripcdn.com/images/0104j12000mr6gcvq84A6.jpg,4.4,70,9.11,it is GREAT! their staff also helpful or is it because ✨Vietnamese People✨?😂 the place is near of anything so u can strolling around by walking. recommend to come around 4/5pm so u can catch the sunset 🌅💃,"Standing over 260 metres tall, this iconic building is one of Ho Chi Minh City’s landmarks and an ideal spot for tourists to enjoy stunning views of the city.",https://www.trip.com/travel-guide/attraction/ho-chi-minh-city/saigon-skydeck-142333317?curr=USD&locale=en-US&scene=gsDestination,10.771567,106.704247,"36 Đ. Hồ Tùng Mậu, Bến Nghé, Quận 1, Hồ Chí Minh, Vietnam",9:30 AM-9:30 PM
Cu Chi Tunnel,https://ak-d.tripcdn.com/images/100b0l000000ct3mz3844.jpg,4.6,205,0,"Discover underground village at Cu chi tunnels. Visitors will find it hard to imagine the destruction, damage & defoliation over this whole area, caused by bombing and mines. There is plenty of evidence of the fierce battle that took place here during the 1960s when Cu Chi was a ""Free Target Zone"".","Like an underground village, the Cu Chi Tunnels are one of the three major relics in Ho Chi Minh City. The Cu Chi Tunnels played a surprisingly successful role in the various wars that Vietnam has experienced, so it has become a legendary and popular attraction. The Cu Chi Tunnel is 250 kilometers long and is composed of numerous tunnels less than 80 cm wide, which are divided into three layers, and the third layer is 8 meters deep. Each floor is equipped with air holes extending to the ground indistinctly. There are wells, granaries, conference rooms, and dormitories in the tunnels, like a large military camp. The first floor has to walk in a half-squatting manner, the second floor may have to kneel to advance, and the third floor may even need to crawl forward. Through personal experience, go deep into the authentic, and be shocked by the indomitable national character of the Vietnamese. The tunnel is narrow and there is no room for movement, and it won't take long for you to sweat profusely. The terrain of the Cu Chi tunnels is relatively intact, and the wreckage of helicopters, chariots, and bunkers can still be seen on the ground, quietly spreading in special scenic spots, reminding people of the ruthlessness and cruelty of war.",https://www.trip.com/travel-guide/attraction/ho-chi-minh-city/cu-chi-tunnel-10758692?curr=USD&locale=en-US&scene=gsDestination,11.141591,106.461596,"Phú Hiệp, Củ Chi, Ho Chi Minh City, Vietnam",7:00 AM-5:00 PM
Notre Dame Cathedral of Saigon,https://ak-d.tripcdn.com/images/10090y000000m11gb4BB8.jpg,4.3,1099,0,"Vietnam🇻🇳Ho Chi Minh [Notre Dame Cathedral of Saigon] Notre Dame Cathedral of Saigon  The Red Church is the most famous landmark in Saigon. The Central Post Office is on its left. The church was originally named Saigon Notre Dame Cathedral, also known as the Red Church. All the red bricks used in its construction were shipped from France. After more than a hundred years, the color is still bright and has not faded. Modeled after the design of the bell tower of Notre Dame de Paris, the shape is symmetrical and majestic. The two towers are 40 meters high. In front of the main hall stands a statue of the Virgin Mary weighing 4 tons donated by the Roman Church in 1945  Address: 01 Công xã Paris, Bến Nghé, Quận 1, Hồ Chí Minh 70000 Vietnam Transportation: Bus No. 36 Tickets: Free Time: Unknown","The Saigon Notre-Dame Cathedral Basilica is one of the landmark buildings of Ho Chi Minh City. Located in the heart of the city, it was built in the late 19th century. Featuring typical Gothic architecture, the front has two bell towers measuring 40 meters, which are modeled after the design of Paris's Notre Dame Cathedral. On the garden square in front of the church, there stands a 4-ton Virgin Mary statue which was given as a gift from the Church in Rome in 1945. If, by chance, you happen to visit while Mass is going on, you can quietly enter the church to feel the pious religious atmosphere.",https://www.trip.com/travel-guide/attraction/ho-chi-minh-city/notre-dame-cathedral-of-saigon-78967?curr=USD&locale=en-US&scene=gsDestination,10.779786,106.699019,"01 Công trường Công xã Paris, Bến Nghé, Quận 1, Hồ Chí Minh 70000, Vietnam",
Saigon Japan Town,https://ak-d.tripcdn.com/images/1mh3v424x91ouf7fp4414.jpg,4.3,6,0,"Vietnam🇻🇳Ho Chi Minh【Japanese Street】  Saigon Japan Street is located in Ho Chi Minh City, Vietnam. It is an exotic neighborhood that attracts tourists who are interested in Japanese culture. Walking on this street, tourists can feel the strong Japanese atmosphere. There are a variety of Japanese restaurants, cafes and shops on both sides of the street, offering authentic Japanese cuisine and specialty goods. In addition to food, Saigon Japan Street also has some Japanese-style buildings and decorations, creating a unique visual experience. There are also many massage shops, be careful not to be pulled in when passing by.  Address: 8A Đ. Thái Văn Lung, Bến Nghé, Quận 1, Hồ Chí Minh 700000 Vietnam","Saigon Japan Street is located in Ho Chi Minh City, Vietnam. It is an exotic neighborhood that attracts tourists who are interested in Japanese culture. Walking along this street, tourists can feel the strong Japanese atmosphere. There are a variety of Japanese restaurants, cafes and shops on both sides of the street, offering authentic Japanese cuisine and specialty goods. In addition to food, Saigon Japan Street also has some Japanese-style buildings and decorations, creating a unique visual experience. Visitors can find a variety of products related to Japanese culture here, such as kimonos, crafts and books, to satisfy their curiosity about Japanese culture. In addition, cultural activities and exhibitions held from time to time in the neighborhood also provide tourists with more opportunities to learn about Japanese culture. Whether it is tasting food, appreciating architecture, or participating in cultural activities, this place can bring a rich and unforgettable experience to every visitor.",https://www.trip.com/travel-guide/attraction/ho-chi-minh-city/saigon-japan-town-136962584?curr=USD&locale=en-US&scene=gsDestination,10.77937,106.704703,,Open all day
Saigon Zoo & Botanical Garden,https://ak-d.tripcdn.com/images/0104012000f6q0hgk5621.jpg,4.2,98,2.74,"Beautiful zoo! Unfortunately, the tiger and elephant enclosures are very small for them so it's sad, but other than that, the animals look well taken care of. The zoo itself feels like a maze as there are many things to do. It is very big so wear comfortable shoes when visiting!","Grass Bird Garden is one of the most famous animal and botanical gardens in Southeast Asia, and it is also the largest animal and botanical garden in Vietnam. It has a history of more than 100 years and covers an area of 32 hectares. The origin of the name of the grass bird garden. Most of the tropical plants grown in Vietnam are planted in the botanical garden. It is a large and colorful garden, decorated with rockeries, pavilions and bonsai, which is refreshing and pleasant. The characteristic of this grass and bird garden is that it is planted with huge and lush trees, accompanied by lush green lawns and well-designed flower beds. It covers an area of 33 hectares.",https://www.trip.com/travel-guide/attraction/ho-chi-minh-city/saigon-zoo-and-botanical-garden-10521719?curr=USD&locale=en-US&scene=gsDestination,10.787334,106.705057,"2 Đ. Nguyễn Bỉnh Khiêm, Bến Nghé, Quận 1, Hồ Chí Minh 700000, Vietnam",
