name,img,rating,review_count,short_desc,long_desc,coordinate,address,price,opening_times
Pho Dau,https://ak-d.tripcdn.com/images/0102e12000jfq079mE822.jpg,5.0,6,"Founded in 1958, smooth pho carries the soul of Vietnamese cuisine.",,"10.78233, 106.69205","288 / M1 Nam Ky Khoi Nghia | Ward 8, District 3, Ho Chi Minh City 700000, Vietnam",3.0,Mon to Sun：_05:00-13:00 
Marcel Gourmet Burger,https://ak-d.tripcdn.com/images/100b12000000ssdog62CB.jpg,5.0,1,,,"10.7686388, 106.6986223","132 Calmette, D1 Saigon, Vietnam",9.0,Mon to Sun：_11:00-22:00 
Au Pagolac,https://ak-d.tripcdn.com/images/100d0u000000iuh45C936.jpg,0.0,0,,,"10.753157, 106.6724","978 Tran Hung Dao, Ward 7, District 5, Ho Chi Minh City 700000, Vietnam",9.0,Mon to Sun：_10:00-22:00 
The Lunch Lady (Nguyen Thi Thanh),https://ak-d.tripcdn.com/images/100s0g0000007q7sgC406.jpg,0.0,8,,,"10.7917441, 106.7044226","23 Hoang Sa St., District 1 | Phuong Da Kao, District 1, Ho Chi Minh City 70000, Vietnam",4.0,Mon to Sat：_10:30-15:30 
La Plancha,https://ak-d.tripcdn.com/images/100b0g0000007q89h7D25.jpg,0.0,0,,,"10.8049945, 106.739891","25 Tran Ngoc Dien, Thao Dien, Q2, Ho Chi Minh City, Vietnam",19.0,Mon to Sun：_11:00-23:00 
Kohaku UDON & RAMEN - Phan Xích Long,https://ak-d.tripcdn.com/images/0106e12000o05s4yc54CC.jpg,5.0,1,,,"10.7979478, 106.6896024","246 Phan Xích Long, Phường 7, Phú Nhuận, Thành phố Hồ Chí Minh, Vietnam",6.0,Mon to Sun：_9:00-22:00 
Brix Wine Bar & Kitchen,https://ak-d.tripcdn.com/images/100t0o000000f6fia6A03.jpg,0.0,0,,,"10.771305, 106.702489","42 Pasteur Ben Nghe Ward, District 1, Ho Chi Minh City 700000 Vietnam",12.0,Mon to Sun：_13:00-01:00 
Quan Thuy,https://ak-d.tripcdn.com/images/100o050000000s28bAD41.jpg,0.0,2,,,"10.79018, 106.69773","84 Dinh Tien Hoang St., Dist.1, Ho Chi Minh City, Vietnam",14.0,Mon to Sun：_09:00-23:00 
The Alley Cocktail Bar & Kitchen,https://ak-d.tripcdn.com/images/0102a12000chu4ftz3A25.jpg,5.0,1,,,"10.7748762, 106.700202","63/8 Pasteur Street, Ho Chi Minh City, Vietnam",14.0,Mon to Wed：_17:00-23:59 _Thur：_17:00-1:00 
Urbane Lounge,https://ak-d.tripcdn.com/images/10070n000000efyd35453.jpg,0.0,0,,,"10.7641994, 106.6918067","148 Tran Hung Dao Blvd District 1, inside Pullman Hotel, Ho Chi Minh City Vietnam",6.0,Mon to Sun：_06:00-22:00 
DB Restaurant,https://ak-d.tripcdn.com/images/10010n000000er9l7F87E.jpg,0.0,0,,,"10.7653618, 106.6898929","117 Cong Quynh, Nguyen Cu Trinh Ward, District 1, Ho Chi Minh City 700000 Vietnam",7.0,Mon to Sun：_06:30-23:00 
After Tapas & Wine Restaurant,https://ak-d.tripcdn.com/images/100j0g0000007pp3744D9.jpg,0.0,0,,,"10.78143, 106.7060842","28B Ngo Van Nam District 1, Ho Chi Minh City 700000 Vietnam",8.0,Mon to Sun：_11:00-23:30 
Bamboo Sushi Restaurant,https://ak-d.tripcdn.com/images/10060o000000f6ub0123C.jpg,0.0,0,,,"10.7970791, 106.6871672","104 Cu Lao Street Ward 2, Phu Nhuan District, Ho Chi Minh City 70000 Vietnam",4.0,Mon to Sun：_10:00-22:00 
'NAMO Italian Restaurant,https://ak-d.tripcdn.com/images/100u0g0000007pye577DC.jpg,0.0,0,,,"10.777925, 106.7037849","74/6 Hai Ba Trung, Ho Chi Minh City 700000, Vietnam",21.0,Mon to Tues：_11:00-22:00 _Wed to Sun：_11:00-23:00 
Ben Nay Restaurant,https://ak-d.tripcdn.com/images/100c060000001n6t95792.jpg,0.0,0,,,"11.0133843, 106.5646575","07 Phu Thuan Phu Hoa Dong, Cu Chi, Ho Chi Minh City 700000 Vietnam",0,Mon to Sun：_8:00-15:30 
SaigonSteak123 Steakhouse,https://ak-d.tripcdn.com/images/fd/tg/g5/M04/C5/92/CggYsVc6vR2AIzWwAAGRtHomXos471.jpg,0.0,0,,,"10.772373, 106.6996464","No123 Le Loi street, Ben Thanh ward, district 1 HCMC Ben Thanh market, Ho Chi Minh City 70000 Vietnam",245.0,Mon to Sun：_10:00-23:00 
The Tavern PMH,https://ak-d.tripcdn.com/images/100u060000001n6crD078.jpg,5.0,8,,,"10.7327436, 106.7086255","R2-24 Hung Gia 3, Bui Bang Doan Street Phu My Hung, Ho Chi Minh City 700000 Vietnam",0,Mon to Thur：_11:00-23:59 _Fri：_11:00-2:00 _Sat：_8:30-2:00 _Sun：_8:30-23:59 
Bibi At Alibi,https://ak-d.tripcdn.com/images/100g0g0000007q5tv99E8.jpg,0.0,0,,,"10.7776353, 106.7044058","5A nguyen sieu st. | district 1, Ho Chi Minh City, Vietnam",10.0,Mon to Sun：_11:30-14:00 
OMG!,https://ak-d.tripcdn.com/images/100e1g000001h9tff81AC.jpg,4.0,2,,,"10.772017, 106.69743","15-17-19 Nguyen An Ninh Street, District 1, Ho Chi Minh City 70,000 Vietnam",28.0,Mon to Sun：_17:00-01:00 
Pho Anh,https://ak-d.tripcdn.com/images/010691200082wah5kDE1A.jpg,4.0,3,,,"10.7844559, 106.6828148","8-10A Ky Dong, W.9, District 3, Ho Chi Minh City 70000 Vietnam",2.0,Mon to Sun：_6:00-22:00 
Gotcha,https://ak-d.tripcdn.com/images/1007050000000qmke9F16.jpg,0.0,0,,,"10.766069, 106.69113","25 Bui Vien | Ward Pham Ngu Lao, Dist. 1, Ho Chi Minh City 700000, Vietnam",3.0,Mon to Sun：_00:00-23:59 
City Garden,https://ak-d.tripcdn.com/images/100p060000001lzvvE32B.jpg,0.0,0,,,"10.7770582, 106.7047483","38 Hai Ba Trung, Phuong Ben Nghe, Quan 1, Ho Chi Minh City Vietnam",10.0,Mon to Sun：_07:00-23:00 
,https://ak-d.tripcdn.com/images/0103s120009piwtvsD02F.jpg,4.0,1,,,"10.797994, 106.6886441","163 Phan Xích Long, Phường 2, Phú Nhuận, Thành phố Hồ Chí Minh 700000, Việt Nam",0,Mon to Sun：_10:30-22:15 
Nhat Cua Singapore Chili,https://ak-d.tripcdn.com/images/0103412000960yv221A40.jpg,4.0,1,,,"10.755854, 106.682089","476A Tran Hung Dao Ward 2, District 5, Ho Chi Minh City 700000 Vietnam",22.0,Mon to Sun：_11:00-23:00 
NEX Restaurant & Cafe,https://ak-d.tripcdn.com/images//100e15000000xui3f0182.jpg,4.0,1,,,"10.793909, 106.689586","49 Tran Nhat Duat Tan Đinh, District 1, Ho Chi Minh City 700000 Vietnam",0,
RIVIA Food & Dining,https://ak-d.tripcdn.com/images/0101g12000bd2qxsxB1A2.jpg,4.0,4,,,"10.7649668, 106.6920109","18 Nguyễn Cư Trinh, Phường Phạm Ngũ Lão, Quận 1, Ho Chi Minh City, Vietnam",24.0,Mon to Sat：_10:00-22:00 _Sun：_11:00-22:00 
Bo Kho 5 sao,https://ak-d.tripcdn.com/images/010621200089yb2n3143F.jpg,4.0,1,,,"10.763964, 106.69052","81 Nguyen Cu Trinh Nguyen Cu Trinh Ward, District 1, Ho Chi Minh City Vietnam",1.0,
The Bawa's Grill,https://ak-d.tripcdn.com/images/100d0o000000f5bsb0997.jpg,0.0,0,,,"10.794217, 106.680507","72/3b Huynh Van Banh street | ward 15, Phu Nhuan district, Ho Chi Minh City 700000, Vietnam",26.0,Mon to Sun：_11:30-21:45 
Poke Saigon,https://ak-d.tripcdn.com/images/0105p12000bd2pwjz4ED1.jpg,5.0,3,,,"10.7741028, 106.7040883","42/25 Nguyen Hue Street 2nd Floor, Ho Chi Minh City Vietnam",9.0,Mon to Sun：_10:00-21:00 
Pizza 4P’s Ben Thanh,https://ak-d.tripcdn.com/images/0100412000bd2pglo3F5F.jpg,4.0,3,,,"10.773361, 106.6976173","8 Thu Khoa Huan, Ben Thanh Ward, District 1, Ho Chi Minh City",14.0,Mon to Sat：_11:00-23:59 _Sun：_11:00-23:00 
Bosgaurus Coffee Roasters,https://ak-d.tripcdn.com/images/100e0n000000e35762A4B.jpg,0.0,0,,,"10.7889116, 106.7206306","92 Nguyen Huu Canh | Villa 1D5, Sai Gon Pearl, Binh Thanh District, Ho Chi Minh City 70000, Vietnam",5.0,Mon to Fri：_7:30-18:00 _Sat to Sun：_7:30-21:00 
Oliver's Pizza,https://ak-d.tripcdn.com/images/100o0g0000007p9x84F54.jpg,0.0,0,,,"10.7903656, 106.7117273","80/5 Mac Dinh Chi | Dakao, District 1, Ho Chi Minh City 70000, Vietnam",13.0,Mon to Sun：_11:00-23:59 
Sancho Cantina,https://ak-d.tripcdn.com/images/100g0n000000eewfv3050.jpg,0.0,0,,,"10.765583, 106.690605","207 Bui Vien, Ho Chi Minh City 700000 Vietnam",8.0,Mon to Sun：_17:00-02:00 
Latest Recipe,https://ak-d.tripcdn.com/images/0100712000b1tgopn5E43.jpg,0.0,0,,,"10.779917, 106.70737","3C Ton Duc Thang Street | Ben Nghe Ward, District 1, Ho Chi Minh City 70000, Vietnam",52.0,Mon to Sun：_06:00-22:00 
BBQ Saigon Night,https://ak-d.tripcdn.com/images/100h0q000000g40nrE5F8.jpg,5.0,3,,,"10.766493, 106.691686","198/4 Bui Vien, Dist. 1, Ho Chi Minh City 70000, Vietnam",3.0,Mon to Sun：_18:00-04:00 
Villa Royale Antiques and Tearoom,https://ak-d.tripcdn.com/images/10031g000001haaqm437C.jpg,4.0,2,,,"10.8028905, 106.7385625","3 Tran Ngoc Dien Thao Dien D2, Ho Chi Minh City 70000 Vietnam",6.0,Tues to Sun：_10:00-17:00 
Restaurant Le Bourgeois,https://ak-d.tripcdn.com/images/0103n12000d5zznkt07B4.png,0.0,0,,,"10.7766861, 106.7025666","132-134 Dong Khoi St, Ben Nghe Ward, District 1, Ho Chi Minh City 70,000 Vietnam",24.0,Mon to Sun：_06:30-22:30 
The Square,https://ak-d.tripcdn.com/images/100f060000001n5utE1F4.jpg,0.0,5,,,"10.784359, 106.695886","Novotel Saigon Centre, 167 Hai Ba Trung, District 1 | Novotel Saigon Centre, District 3, Ho Chi Minh City, Vietnam",23.0,Mon to Sun：_06:00-22:00 
X-Pose Beer Club,https://ak-d.tripcdn.com/images/0103t12000chudm6317B5.jpg,5.0,1,,,"10.7382125, 106.6269505","97 Đ. Lý Chiêu Hoàng, Phường 10, Quận 6, Thành phố Hồ Chí Minh, Vietnam",9.0,Mon to Sun：_17:00-23:30 
Telephone bar,https://ak-d.tripcdn.com/images/0105u12000jg3325uE897.jpg,4.8,5,,,"10.7708772, 106.6916325","41 Nguyễn Văn Tráng, Phường Phạm Ngũ Lão, Quận 1, Thành phố Hồ Chí Minh, Vietnam",17.0,Mon to Sun：_18:00-2:00 
Pizza 4P's Thiso Mall,https://ak-d.tripcdn.com/images/1zn3j224x8xggz4ko2E12.jpg,5.0,2,,,"10.7724565, 106.7220011","10 Đ. Mai Chí Thọ, Thủ Thiêm, Quận 2, Thành phố Hồ Chí Minh, Vietnam",0,Mon to Sun：_10:00-22:00 
FLATTO COFFEE and LOUNGE,https://ak-d.tripcdn.com/images/01043120009hj1vk01F70.jpg,4.0,1,,,"10.7243771, 106.7095367","145 Đ. số 10, Tân Phong, Quận 7, Thành phố Hồ Chí Minh 70000",0,Mon：_Closed all day _Tues to Sun：_07:00-15:00 _17:00-00:00 
Haidilao,https://ak-d.tripcdn.com/images/01017120005c5qzjt93F4.jpg,4.0,2,,,"10.771733, 106.70468",,0,Mon to Sun：_10:00-4:00 
IL CORDA Charcoal Steakhouse,https://ak-d.tripcdn.com/images/0105q120009dvpbm6F64D.jpg,4.0,2,,,"10.7814616, 106.7057042","11 Đ. Lê Thánh Tôn, Bến Nghé, Quận 1, Thành phố Hồ Chí Minh, Việt Nam",0,Mon to Sun：_11:00-14:30 _17:00-23:00 
Paris Bistro,https://ak-d.tripcdn.com/images/100b0o000000f91izC805.jpg,0.0,0,,,"10.7850234, 106.6998908","20 Nguyen Thi Minh Khai | Dist. 1, Ho Chi Minh City 700000, Vietnam",15.0,Mon to Sun：_09:00-22:00 
Latra,https://ak-d.tripcdn.com/images/10060o000000f7bl80FC3.jpg,0.0,0,,,"10.77013, 106.6888947","157 Le Thi Rieng | Dist. 1, Ho Chi Minh City, Vietnam",3.0,Mon to Sun：_08:00-22:00 
Aloha,https://ak-d.tripcdn.com/images/100s0o000000fdkvr6B07.jpg,0.0,0,,,"10.774718, 106.703963","88 Mac Thi Buoi Q1 HCM, Ho Chi Minh City Vietnam",16.0,Mon to Sun：_11:00-19:00 
Ran Bien 5 Restaurant,https://ak-d.tripcdn.com/images/100t0n000000e0cgg93D5.jpg,0.0,0,,,"10.7869122, 106.6867344","193-195 Nam Ky Khoi Nghia Ward 7, Ho Chi Minh City Vietnam",75.0,Mon to Sun：_10:00-23:00 
Saigon Craft Bar And Grill,https://ak-d.tripcdn.com/images/10080n000000eeif40693.jpg,0.0,0,,,"10.7231977, 106.7098417","68 Ly Long Tuong St My Phuc Apartment Building Phu My Hung District 7, Ho Chi Minh City Vietnam",14.0,Mon to Sun：_15:30-1:00 
Cafe Vy,https://ak-d.tripcdn.com/images/100b14000000wz5821529.jpg,5.0,2,,,"10.7716122, 106.6955211","278 Le Thanh Ton, Ben Thanh Ward, District 1, Ho Chi Minh City 70,000 Vietnam",0,Mon to Sun：_pen all day 
Miya Sushi BBQ Restaurant,https://ak-d.tripcdn.com/images/100j0o000000f632oE42F.jpg,0.0,0,,,"10.7700939, 106.6901159","150/26 Nguyen Trai, Quan 1, TP HCM, Ho Chi Minh City 700000 Vietnam",8.0,Mon to Sun：_10:30-14:00 _17:00-21:30 
Parivar Indian Cuisine,https://ak-d.tripcdn.com/images/100m0g0000007pc472D6B.jpg,0.0,0,,,"10.7775455, 106.7043717","5A Nguyen Sieu Street, Ben Nghe Ward, District 1 Near Mai Linh Taxi Office, Ho Chi Minh City 700000 Vietnam",6.0,Mon to Sun：_10:00-23:00 
Here & Now Vegetarian (Open kitchen & chill),https://ak-d.tripcdn.com/images/100e0g0000007pg9o3848.jpg,0.0,0,,,"10.798405, 106.673836","89E Nguyen Cong Hoan | Ward 7, Phu Nhuan District, Ho Chi Minh City 700000, Vietnam",5.0,Mon to Sun：_10:00-14:00 _17:00-22:00 
Malt Saigon Bar,https://ak-d.tripcdn.com/images/0ww5612000b61s8ls46DE.jpg,0.0,0,,,"10.7754101, 106.7047114","46-48 Mac Thi Buoi, District 1, Ho Chi Minh City 70,000 Vietnam",5.0,Mon to Sun：_15:00-23:59 
Burger King Grand Hotel Restaurant,https://ak-d.tripcdn.com/images/100d0n000000ebcnt2D91.jpg,0.0,0,,,"10.774103, 106.70574","8 Đong Khoi Street, Ben Nghe Ward, District 1 | Inside Grand Hotel, Ho Chi Minh City, Vietnam",4.0,Mon to Sun：_09:00-22:00 
Burger King,https://ak-d.tripcdn.com/images/10060g0000007pf1oF708.jpg,0.0,0,,,"10.76633, 106.69167","141 Bui Vien Pham Ngu Lao, District 1, Ho Chi Minh City Vietnam",3.0,Mon to Sun：_9:00-23:00 
Sahara Beer Club & VIP Lounge,https://ak-d.tripcdn.com/images/1007hk12492mf13w09718.jpg,0.0,0,,,"10.766499, 106.69223","113 Bui Vien Street, District 1 Pham Ngu Lao ward, District 1, Ho Chi Minh City 700000 Vietnam",12.0,Mon to Sun：_00:00-23:59 
Nabe King,https://ak-d.tripcdn.com/images/100l0n000000eehdm1083.jpg,0.0,0,,,"10.932878, 106.71185","01 Binh Duong Boulevard, Binh Giao, Thuan Giao Ward, Thuan An Town Lot E, Second Floor, Aeon Mall Canary, Ho Chi Minh City 700000 Vietnam",9.0,Mon to Sun：_10:00-22:00 
GreenS,https://ak-d.tripcdn.com/images/10060g0000007ptt6766A.jpg,0.0,0,,,"10.77828, 106.69376","18A / 100 Nguyen Thi Minh Khai District 1, Ho Chi Minh City 700000 Vietnam",5.0,Mon to Sun：_09:00-14:30 _17:00-22:00 
Ember,https://ak-d.tripcdn.com/images/100f1d000001e9nv8A000.jpg,4.0,1,,,"10.773077, 106.70127","65 Le Loi 1st Floor, Saigon Centre Building, Ben Nghe Ward, District 1, Ho Chi Minh City 700000 Vietnam",12.0,Mon to Sun：_07:45-22:30 
Dau Homemade,https://ak-d.tripcdn.com/images/1mh0d224x8uk9ftfy20EA.jpg,5.0,1,,,"10.81335, 106.66606","So 6 Hong Ha | Ward 2, Tan Binh District, Ho Chi Minh City 700, Vietnam",3.0,Mon to Sun：_10:00-22:00 
Spice Bistro,https://ak-d.tripcdn.com/images//100915000000xgoyg9352.jpg,4.0,1,,,"10.776886, 106.70608","2 Thi Sach Street | District 1, Ho Chi Minh City 700000, Vietnam",12.0,Mon to Sat：_10:00-18:00 
Sinh to 142,https://ak-d.tripcdn.com/images/100o0n000000ec5wj2E5F.jpg,0.0,0,,,"10.7871151, 106.6846528","142 Ly Chinh Thang St., Dist. 3, Ho Chi Minh City, Ho Chi Minh City, Vietnam",0,Mon to Sun：_8:00-22:00 
Mon Viet,https://ak-d.tripcdn.com/images/100h050000000xpdeC380.jpg,0.0,0,,,"10.773333, 106.69806","148 Le Thanh Ton | District 1, Ho Chi Minh City, Vietnam",4.0,Mon to Sun：_10:00-23:00 
Paceycupcakes,https://ak-d.tripcdn.com/images/01028120008crsuy900BB.jpg,4.5,3,,,"10.77995, 106.700951","53g Nguyen Du street, Ben Nghe ward, district 1, Ho Chi Minh City 084 Vietnam",0,
Lodge Bui Restaurant -Live Music,https://ak-d.tripcdn.com/images/100h0o000000f7uroFF92.jpg,0.0,0,,,"10.78399, 106.69442","39/2 Pham Ngoc Thach Street Ward 6-Dist. 3, Ho Chi Minh City 084 Vietnam",26.0,Mon to Sun：_07:00-23:00 
Nha hang an ngon Loc Phat,https://ak-d.tripcdn.com/images/1me5q12000gmfe47361BD.jpg,0.0,1,,,"10.78806, 106.68859","68B Tran Quoc Toan.Q3, Ho Chi Minh City 70000 Vietnam",0,
Hoang Yen Buffet,https://ak-d.tripcdn.com/images/1001060000001n6uw68FB.jpg,0.0,0,,,"10.78867, 106.709656","Me Linh Point Tower 1st floor, 02 Ngo Duc Ke, D1, Ho Chi Minh City 70000 Vietnam",11.0,Mon to Sun：_10:00-22:00 
Binh An Village Saigon,https://ak-d.tripcdn.com/images/100l060000001n6s9BAC1.jpg,0.0,0,,,"10.817619, 106.721344","1163 Binh Quoi Street, Ho Chi Minh City 70000 Vietnam",21.0,Mon to Sun：_10:00-22:00 
Bonjour Resto' Nguyen Trai,https://ak-d.tripcdn.com/images/1007060000001n6o904AC.jpg,0.0,0,,,"10.77023, 106.68979","150/18 Nguyen Trai, Quan 1, Ho Chi Minh City 70000, Vietnam",5.0,Mon to Sun：_09:00-22:00 
El Sol Meat & Wine,https://ak-d.tripcdn.com/images/100s060000001n6vn6E24.jpg,0.0,0,,,"10.787699, 106.691246","140 Vo Thi Sau st 140/2 District 3, Ho Chi Minh City 700000 Vietnam",26.0,Mon to Sun：_11:00-22:30 
Blanc. Restaurant Saigon,https://ak-d.tripcdn.com/images/0100212000bcv927q50B9.jpg,5.0,11,,,"10.7865182, 106.6947055",Lane 178/180D Hai Ba Trung .Dakao . District 1 .HCMC. Vietnam,29.0,Mon：_Closed all day _Tues to Sun：_17:30-23:00 
Baoz Dimsum,https://ak-d.tripcdn.com/images/100g060000001n6th35EC.jpg,3.5,6,,,"10.7531011, 106.6696548","86-88 Nguyen Tri Phuong Street | Ward 7, District 5, Ho Chi Minh City, Vietnam",11.0,Mon to Sun：_6:30-22:30 
Steak Deli Steakontherock & Cafe,https://ak-d.tripcdn.com/images/100h060000001n6uoB2B1.jpg,3.0,5,,,"10.771763, 106.69316","6/1 Cach Mang Thang 8 Ben Thanh Ward, District 1, Ho Chi Minh City 700000 Vietnam",8.0,Mon to Sun：_07:00-22:30 
Qua Ngon Restaurant,https://ak-d.tripcdn.com/images/1i61p2224sd82u7ow91FB.jpg,0.0,7,,,"10.7968835, 106.6652361","308 306, Le Van Sy Street Ward 1, District Tan Binh, Ho Chi Minh City 700000 Vietnam",28.0,Mon to Sun：_09:00-23:00 
C.ON Global Food Factory,https://ak-d.tripcdn.com/images/10030o000000f8ep71A15.jpg,0.0,0,,,"10.7807529, 106.6902377","23B Ngo Thoi Nhiem, Ward 6, Disc 3, Ho Chi Minh City 700000 Vietnam",4.0,"Mon to Thur,Sun：_06:30-23:00 _Fri to Sat：_06:30-00:00 "
DeciBel Cafe/Lounge,https://ak-d.tripcdn.com/images/100v060000001n6i97A42.jpg,0.0,0,,,"10.78934, 106.70004","79/2/5 Phan Ke Binh, W. Da Kao, District 1, Ho Chi Minh City 70,000 Vietnam",12.0,Mon to Sat：_07:30-00:00 
Acoustic Bar - Ngo Thoi Nhiem,https://ak-d.tripcdn.com/images/0100n12000okha75t7B9C.jpg,5.0,2,,,"10.7811947, 106.6899157","6 E1 Ngo Thoi Nhiem Street Ward 7, District 3, Ho Chi Minh City 70000 Vietnam",14.0,Mon to Sun：_19:00-00:00 
Non La Restaurant,https://ak-d.tripcdn.com/images/100b060000001m02fB3FA.jpg,0.0,0,,,"10.78921, 106.70035","19 Nguyen Dinh Chieu Str.,Dist.1, Ho Chi Minh City 70000, Vietnam",8.0,Mon to Sun：_11:00-23:00 
MON Restaurant & Bar,https://ak-d.tripcdn.com/images/fd/tg/g5/M01/BE/80/CggYsFc6phiANXiKAADoDwTuAR8257.jpg,0.0,0,,,"10.78056, 106.69871","34 Le Duan St. Dist 1, Ho Chi Minh City 70,000 Vietnam",49.0,Mon to Sun：_10:00-10:00 
The Bean Store,https://ak-d.tripcdn.com/images/100e060000001lzss1E8C.jpg,0.0,0,,,"10.7703334, 106.6846537","399 Vo Van Tan, District 3, Ho Chi Minh City, Vietnam, Ho Chi Minh City 70,000 Vietnam",2.0,Mon to Sun：_09:00-22:00 
Izakaya Matsuki 18A Thai Van Lung,https://ak-d.tripcdn.com/images/0103h12000o05lrk54F52.jpg,5.0,1,,,"10.780079, 106.703907","18 Thái Văn Lung, Bến Nghé, Quận 1, Thành phố Hồ Chí Minh, Vietnam",14.0,Mon to Sun：_17:00-02:00 
Au Parc,https://ak-d.tripcdn.com/images/100o0g0000007q6x3AC0F.jpg,4.0,7,,,"10.7787276, 106.6980638","p. q. 1, 23 Hàn Thuyên, Bến Nghé, Hồ Chí Minh",12.0,"Mon to Thur,Sun：_7:30-22:30 _Fri to Sat：_7:30-23:00 "
Bánh Xèo Ngọc Sơn,https://ak-d.tripcdn.com/images/0104y12000etvdxou0CD7.jpg,0.0,0,,,"10.7544526, 106.6663377","103 Đ. Ngô Quyền, Phường 11, Quận 5, Thành phố Hồ Chí Minh 700000, Vietnam",0,Mon to Sun：_9:00-21:00 
Canalis Club,https://ak-d.tripcdn.com/images/0102l12000chulihk932F.jpg,5.0,2,An immersive club with spectacular performances to light up your night,,"10.7873557, 106.6868219","264Bis - Nam Kì Khởi Nghĩa, Phường Võ Thị Sáu, Quận 3, Ho Chi Minh City, Vietnam",45.0,Mon：_21:00-03:00 _Tues to Sun：_20:00-03:00 
Black Vinegar,https://ak-d.tripcdn.com/images/0103j12000mlhxjql942A.jpg,5.0,1,,,"10.770925, 106.69504","76 Le Lai 1st Floor, Ho Chi Minh City 700000 Vietnam",14.0,Mon to Sun：_11:30-15:00 _17:30-22:30 
Sushi Kei Landmark 81,https://ak-d.tripcdn.com/images/0104l12000o05yyvvD8D5.jpg,5.0,1,,,"10.7948272, 106.7220371","772 Dien Bien Phu Basement 1, Vincom Center Landmark 81, Ward 22, Binh Thanh, Ho Chi Minh City 700000 Vietnam",16.0,"Mon to Thur,Sun：_10:00-22:00 _Fri to Sat：_09:30-22:00 "
Com Xiu,https://ak-d.tripcdn.com/images/10061g000001h97jg4BDF.jpg,4.0,1,,,"10.771297, 106.6906",,0,Mon to Sun：_11:00-21:30 
IPPUDO Le Thanh Ton Japanese Ramen Restaurant,https://ak-d.tripcdn.com/images/0103u12000nvkjhhmE1E7.jpg,5.0,1,,,"10.779907, 106.7034","17/5 Lê Thánh Tôn, Bến Nghé, Quận 1, Hồ Chí Minh 700000, Vietnam",10.0,Mon to Sun：_11:00-23:00 
The Melbourne Cafe Restaurant,https://ak-d.tripcdn.com/images/0101k120008eenu154839.jpg,4.0,1,,,"10.765634, 106.69068",,0,Mon to Fri：_06:00-22:00 _Sat：_07:00-22:00 _Sun：_08:00-22:00 
Arcan,https://ak-d.tripcdn.com/images/0102o12000d3964lgF199.jpg,5.0,1,,,"10.797805, 106.7082301","29/2H Đ. Điện Biên Phủ, Phường 17, Bình Thạnh, Thành phố Hồ Chí Minh 700000",8.0,Fri to Sat：_22:00-5:00 
The ATM Cocktail Bar & Kitchen,https://ak-d.tripcdn.com/images/0102e12000jg56kes3EB0.jpg,4.6,5,,,"10.79039, 106.70159","27/10 Nguyen Binh Khiem Dakao Ward, District 1, Ho Chi Minh City 700000 Vietnam",5.0,Mon to Thur：_17:00-00:00 _Fri to Sat：_17:00-01:00 _Sun：_Closed all day 
Com Ga Ba Ngan - Hoi An Chinh Goc,https://ak-d.tripcdn.com/images//100t15000000xopmd9890.jpg,4.0,1,,,"10.786062, 106.64493","11 Road No. 4 Near Vinmart, Ni Su Huynh Lien, Ho Chi Minh City 700000 Vietnam",2.0,Mon to Sun：_09:00-22:00 
The Hidden Elephant Books & Coffee,https://ak-d.tripcdn.com/images/0102c120006puj8pa5778.jpg,4.0,1,,,"10.772408, 106.6972096","35 Phan Chu Trinh | Floor 2, Ben Thanh Ward, District 1, Ho Chi Minh City 700000, Vietnam",0,
agataJapan.cafe,https://ak-d.tripcdn.com/images/100g0o000000f723zAFF1.jpg,0.0,0,,,"10.7924419, 106.6907725","19 Dang Dung | Tan Dinh Ward, Ho Chi Minh City, Vietnam",4.0,Mon to Sun：_10:00-19:00 
Karen's Cafe,https://ak-d.tripcdn.com/images/100c0n000000egzohA960.jpg,0.0,0,,,"10.77374, 106.69735","25 Thu Khoa Huan | Ground Floor/First Floor, Ho Chi Minh City, Vietnam",3.0,Mon to Sun：_07:00-23:00 
Dosh,https://ak-d.tripcdn.com/images/1A04180000013ef3k26CF.jpg,0.0,1,,,"10.774012, 106.704163","42 Nguyen Hue 3rd Floor, District 1, Ho Chi Minh City Vietnam",2.0,Mon to Sun：_9:00-22:00 
Luna Sushi,https://ak-d.tripcdn.com/images/100o0o000000f5qnfB2B9.jpg,0.0,0,,,"10.778776, 106.69038","14a Hoa My Da Kao, District 1, Ho Chi Minh City Vietnam",25.0,Mon to Fri：_10:30-15:00 _16:30-22:30 _Sat to Sun：_11:00-15:00 _16:30-23:00 
Banh da cua Di Ly,https://ak-d.tripcdn.com/images/100m0o000000ffu8r24FD.jpg,0.0,0,,,"10.77504, 106.70422","103 Dong Khoi Street District 1 Diagonally opposite Sheraton Hotel, Ho Chi Minh City Vietnam",11.0,Mon to Sun：_08:00-22:00 
Gringo Tacos y Cantina,https://ak-d.tripcdn.com/images/100n0n000000dzf25FC82.jpg,0.0,0,,,"10.768887, 106.69827","137 Calmette District 1, Ho Chi Minh City 700000 Vietnam",5.0,Mon to Sun：_11:00-22:00 
Cha Ca Dong Kinh Restaurant,https://ak-d.tripcdn.com/images/10020n000000e7dexC840.jpg,0.0,0,,,"10.769428, 106.7029","87 Nguyen Cong Tru Street P. Nguyen Thai Binh. District 1, Ho Chi Minh City Vietnam",8.0,Mon to Sun：_10:00-22:00 
ICHIBAN Japanese Hotpot Buffet,https://ak-d.tripcdn.com/images/100s0o000000fd4o7CBEE.jpg,0.0,0,,,"10.803675, 106.66495","14A Phan Dinh Giot Street, Ward 2, Tan BInh District, Ho Chi Minh, Vietnam, Ho Chi Minh City 700000 Vietnam",12.0,Mon to Sun：_11:00-14:00 _17:00-22:00 
Ngo Saigon Street Cafe Restaurant,https://ak-d.tripcdn.com/images/100t0g0000007q5po33CA.jpg,0.0,0,,,"10.78198, 106.70598","70-72 Le Thanh Ton Street, District 1 B3-19B, VINCOM Center Shopping Mall, Ho Chi Minh City 70000 Vietnam",4.0,Mon to Sun：_10:00-21:30 
Dailo's Kitchen and Bar,https://ak-d.tripcdn.com/images/10040n000000ec12i69D4.jpg,0.0,0,,,"10.779222, 106.7058","No. 6, Thai Van Lung | End of Nguyen Sieu, Ho Chi Minh City 70000, Vietnam",18.0,Mon to Sun：_09:00-00:00 
Phuc Long Coffee & Tea Express,https://ak-d.tripcdn.com/images/10010g0000007q82x2449.jpg,0.0,0,,,"10.7747135, 106.7043115","29 Ngo Duc Ke Q 1, Ho Chi Minh City 700000",1.0,Mon to Sun：_7:00-22:30 
Chewy Junior,https://ak-d.tripcdn.com/images/0106u1200098dzx8o6B36.jpg,4.0,1,,,"10.76717, 106.69446","34 Tran Hung Dao Street, Ho Chi Minh City, Vietnam",26.0,Mon：_07:00-17:00 
Rita Võ Cafe,https://ak-d.tripcdn.com/images/1002050000000l695170D.jpg,0.0,0,,,"10.7603402, 106.683306","211 Nguyen Van Cu District 1, Ho Chi Minh City 70,000 Vietnam",0,Mon to Sun：_7:00-23:00 
Inter Nos Dining & Grill Restaurant,https://ak-d.tripcdn.com/images/10040o000000f5jsp4F10.jpg,0.0,0,,,"10.805304, 106.73402","26 Le Van Mien | Thao Dien ward, District 2, Ho Chi Minh City 700000, Vietnam",23.0,Mon to Sun：_11:00-23:00 
Bookmark Restaurant,https://ak-d.tripcdn.com/images/100w060000001n6x0E6A4.jpg,4.0,2,,,"10.7955477, 106.6770165","133A Nguyen Dinh Chinh Phu Nhuan District, Ho Chi Minh City 700000 Vietnam",24.0,Mon to Sun：_06:00-22:00 
Plantrip Cha,https://ak-d.tripcdn.com/images/100r0o000000f4m7s16AC.jpg,0.0,0,,,"10.786808, 106.691444","88 Pham Ngoc Thach st. First Floor, Ho Chi Minh City 700000 Vietnam",3.0,Mon to Sat：_09:00-21:00 
Xien Xien Hot Pot Restaurant,https://ak-d.tripcdn.com/images/fd/tg/g5/M04/C4/23/CggYsVc6teOAQjHIAAFhhijmfcw722.jpg,0.0,0,,,"10.767222, 106.69053","59 Do Quang Dau Street District 1, Ho Chi Minh City 70000 Vietnam",2.0,Mon to Sun：_10:00-22:00 
Leng Keng Zone,https://ak-d.tripcdn.com/images/100d060000001n6vnCA8E.jpg,0.0,0,,,"10.7945845, 106.7089137","131 Xo Viet Nghe Tinh, Binh Thanh Dist, Ho Chi Minh City 70000, Vietnam",9.0,Mon to Sun：_11:00-23:30 
Mr. BBQ & SsAm,https://ak-d.tripcdn.com/images/100k060000001n6vnDB86.jpg,0.0,0,,,"10.724137, 106.71626","137 Ton Dat Tien, Ho Chi Minh City 84, Vietnam",6.0,Mon to Sun：_07:00-21:00 
Cafe Bar KESERA,https://ak-d.tripcdn.com/images/100e060000001n6ri25A1.jpg,0.0,0,,,"10.7803451, 106.7040564","26-1 Le Thang Tong, Ho Chi Minh City, Vietnam",4.0,Mon to Sat：_08:00-23:00 _Sun：_08:00-18:00 
Kabin,https://ak-d.tripcdn.com/images/0107112000mlhm82x991B.jpg,5.0,3,,,"10.7743695, 106.7062585","8-15 Ton Duc Thang Street, District 1 Renaissance Riverside Hotel Saigon, Ho Chi Minh City 70000 Vietnam",38.0,Mon to Sun：_11:30-14:30 _18:00-22:00 
